{
  "$schema": "https://json-schema.org/draft/2020-12/schema",
  "additionalProperties": false,
  "properties": {
    "artifact_id": {
      "const": "V0_OSAP_GATE3_CLUSTER_B_WP5_REPLAY_RECORD"
    },
    "baseline_commit": {
      "const": "7b497f197652874164e00fe9c0ef7f67e760c979"
    },
    "bundle_size_bytes": {
      "minimum": 1,
      "type": "integer"
    },
    "byte_identical": {
      "const": true
    },
    "canonical_bundle_sha256": {
      "pattern": "^[0-9a-f]{64}$",
      "type": "string"
    },
    "date": {
      "minLength": 1,
      "type": "string"
    },
    "generation_state": {
      "const": "GENERATED_AND_LOCKED"
    },
    "run_1_sha256": {
      "pattern": "^[0-9a-f]{64}$",
      "type": "string"
    },
    "run_2_sha256": {
      "pattern": "^[0-9a-f]{64}$",
      "type": "string"
    },
    "run_count": {
      "const": 2
    },
    "serialization_profile": {
      "const": "V0_OSAP_CJ_1_SORTED_UTF8_COMPACT"
    },
    "version": {
      "const": "0.1"
    }
  },
  "required": [
    "artifact_id",
    "version",
    "date",
    "baseline_commit",
    "run_count",
    "serialization_profile",
    "run_1_sha256",
    "run_2_sha256",
    "bundle_size_bytes",
    "byte_identical",
    "canonical_bundle_sha256",
    "generation_state"
  ],
  "type": "object"
}
