{
  "artifact_id": "V0_OSAP_GATE3_CLUSTER_B_WP5_REPLAY_RECORD",
  "baseline_commit": "7b497f197652874164e00fe9c0ef7f67e760c979",
  "bundle_size_bytes": 4618,
  "byte_identical": true,
  "canonical_bundle_sha256": "bb3b3ec9621ed14d6c52d49efcdfe185facb58de446e4930f07f6a2dd3b1deef",
  "date": "2026-07-23",
  "generation_state": "GENERATED_AND_LOCKED",
  "run_1_sha256": "bb3b3ec9621ed14d6c52d49efcdfe185facb58de446e4930f07f6a2dd3b1deef",
  "run_2_sha256": "bb3b3ec9621ed14d6c52d49efcdfe185facb58de446e4930f07f6a2dd3b1deef",
  "run_count": 2,
  "serialization_profile": "V0_OSAP_CJ_1_SORTED_UTF8_COMPACT",
  "version": "0.1"
}
